{
  "$schema": null,
  "spec_id": "05",
  "spec_name": "spec_agentic_cli",
  "schema_version": 1,
  "test_cases": [
    {
      "id": "TS-05-1",
      "requirement_id": "05-REQ-1.1",
      "kind": "unit",
      "description": "Verify that spec/cli.py declares its root Click group using cls=AgentFoxGroup instead of the bare @click.group() decorator.",
      "preconditions": [
        "spec/cli.py has been migrated",
        "agentfox.io module is installed and importable"
      ],
      "input": "Import the root CLI group object from spec/cli.py",
      "expected": "The root group object's class is AgentFoxGroup (i.e., type(root_group) is AgentFoxGroup)",
      "assertion_pseudocode": "from spec.cli import cli; assert type(cli) == AgentFoxGroup OR isinstance(cli, AgentFoxGroup)"
    },
    {
      "id": "TS-05-2",
      "requirement_id": "05-REQ-1.2",
      "kind": "unit",
      "description": "Verify that spec/cli.py contains no manual banner rendering or config loading code after migration.",
      "preconditions": [
        "spec/cli.py has been migrated",
        "Access to spec/cli.py source file"
      ],
      "input": "Read the source text of spec/cli.py",
      "expected": "Source contains no calls to manual banner rendering functions or manual config loading that predated AgentFoxGroup adoption",
      "assertion_pseudocode": "source = read_file('spec/cli.py'); assert 'render_banner' not in source; assert manual_config_load_pattern not in source"
    },
    {
      "id": "TS-05-3",
      "requirement_id": "05-REQ-1.3",
      "kind": "unit",
      "description": "Verify that _json_error_exit() and _error_type() helper functions have been removed from spec/cli.py.",
      "preconditions": [
        "spec/cli.py has been migrated"
      ],
      "input": "Read the source text of spec/cli.py",
      "expected": "Neither '_json_error_exit' nor '_error_type' appear as definitions or calls in spec/cli.py",
      "assertion_pseudocode": "source = read_file('spec/cli.py'); assert '_json_error_exit' not in source; assert '_error_type' not in source"
    },
    {
      "id": "TS-05-4",
      "requirement_id": "05-REQ-1.4",
      "kind": "integration",
      "description": "Verify that when AF_AGENT=1 is set, the spec CLI suppresses banner output and routes errors through the AgentFoxGroup JSON error handler.",
      "preconditions": [
        "spec CLI is installed",
        "agentfox.io module is installed",
        "Environment variable AF_AGENT=1 is set"
      ],
      "input": "Invoke `AF_AGENT=1 spec --help` or any valid spec subcommand",
      "expected": "No banner text is written to stdout or stderr; any error is emitted as a JSON object",
      "assertion_pseudocode": "result = run_cli(['spec', '--help'], env={'AF_AGENT': '1'}); assert 'banner' not in result.stdout.lower(); assert 'banner' not in result.stderr.lower()"
    },
    {
      "id": "TS-05-5",
      "requirement_id": "05-REQ-1.5",
      "kind": "integration",
      "description": "Verify that any unhandled exception propagating to the root group is formatted as a JSON error envelope with a non-zero exit code.",
      "preconditions": [
        "spec CLI is installed",
        "A subcommand can be triggered to raise an unhandled exception (e.g., by patching internals)"
      ],
      "input": "Invoke a spec subcommand that raises an unhandled RuntimeError",
      "expected": "stdout contains a JSON object with 'ok: false' or an error field; process exits with non-zero exit code",
      "assertion_pseudocode": "result = run_cli_with_exception_trigger(['spec', 'render']); parsed = json.parse(result.stdout); assert parsed['ok'] == false; assert result.exit_code != 0"
    },
    {
      "id": "TS-05-6",
      "requirement_id": "05-REQ-2.1",
      "kind": "integration",
      "description": "Verify that spec render --json wraps markdown output in a render envelope with ok, format, content, and sections fields.",
      "preconditions": [
        "spec CLI is installed",
        "A valid spec with all artifacts (requirements, test_spec, tasks) exists on disk",
        "agentfox.io module is installed"
      ],
      "input": "Invoke `spec render --json --combined` for a valid spec",
      "expected": "stdout is a JSON object containing ok=true, format='markdown', a non-empty content string, and a sections array",
      "assertion_pseudocode": "result = run_cli(['spec', 'render', '--json', '--combined']); parsed = json.parse(result.stdout); assert parsed['ok'] == true; assert parsed['format'] == 'markdown'; assert 'content' in parsed; assert 'sections' in parsed"
    },
    {
      "id": "TS-05-7",
      "requirement_id": "05-REQ-2.2",
      "kind": "integration",
      "description": "Verify that spec render --combined --json returns a single merged content string in the envelope.",
      "preconditions": [
        "spec CLI is installed",
        "A valid spec with multiple artifacts exists on disk"
      ],
      "input": "Invoke `spec render --json --combined` for a spec with requirements, test_spec, and tasks",
      "expected": "stdout JSON has a single 'content' string (not an 'artifacts' map) containing merged markdown, plus a 'sections' array",
      "assertion_pseudocode": "result = run_cli(['spec', 'render', '--json', '--combined']); parsed = json.parse(result.stdout); assert 'content' in parsed; assert 'artifacts' not in parsed; assert isinstance(parsed['content'], str); assert parsed['sections'] == ['requirements', 'test_spec', 'tasks']"
    },
    {
      "id": "TS-05-8",
      "requirement_id": "05-REQ-2.3",
      "kind": "integration",
      "description": "Verify that spec render --json without --combined returns per-artifact content under an 'artifacts' key.",
      "preconditions": [
        "spec CLI is installed",
        "A valid spec with requirements, test_spec, and tasks artifacts exists on disk"
      ],
      "input": "Invoke `spec render --json` without --combined flag",
      "expected": "stdout JSON has ok=true and an 'artifacts' map with keys for each artifact; no single 'content' key",
      "assertion_pseudocode": "result = run_cli(['spec', 'render', '--json']); parsed = json.parse(result.stdout); assert parsed['ok'] == true; assert 'artifacts' in parsed; assert 'content' not in parsed; assert 'requirements' in parsed['artifacts']"
    },
    {
      "id": "TS-05-9",
      "requirement_id": "05-REQ-2.4",
      "kind": "integration",
      "description": "Verify that spec render without --json outputs raw markdown to stdout with no JSON wrapping.",
      "preconditions": [
        "spec CLI is installed",
        "A valid spec exists on disk",
        "AF_AGENT environment variable is not set"
      ],
      "input": "Invoke `spec render` without any --json flag",
      "expected": "stdout is raw markdown text; json.parse(result.stdout) raises a parse error",
      "assertion_pseudocode": "result = run_cli(['spec', 'render']); assert result.exit_code == 0; assert json_parse_fails(result.stdout); assert result.stdout.strip().startswith('#') OR is_markdown(result.stdout)"
    },
    {
      "id": "TS-05-10",
      "requirement_id": "05-REQ-2.5",
      "kind": "unit",
      "description": "Verify that spec render uses emit_ok from agentfox/io/ to construct all JSON envelopes.",
      "preconditions": [
        "spec/cli.py has been migrated",
        "Access to spec/cli.py source file"
      ],
      "input": "Read the source text of spec/cli.py and inspect the render command implementation",
      "expected": "The render command calls emit_ok (imported from agentfox.io) for all JSON output; no direct json.dumps or click.echo(json...) calls are present in the render handler",
      "assertion_pseudocode": "source = read_file('spec/cli.py'); assert 'emit_ok' in source; render_section = extract_render_handler(source); assert 'json.dumps' not in render_section; assert 'click.echo' not in render_section OR render_section has no json output"
    },
    {
      "id": "TS-05-11",
      "requirement_id": "05-REQ-3.1",
      "kind": "integration",
      "description": "Verify that spec validate emits a structured error object with category='schema', artifact, path, message, and value fields for schema check failures.",
      "preconditions": [
        "spec CLI is installed",
        "A spec artifact file exists with a known schema violation (e.g., malformed requirement ID)"
      ],
      "input": "Invoke `spec validate` on a spec containing a schema error",
      "expected": "stdout JSON has valid=false; errors array contains at least one object with category='schema', non-empty artifact, path, message, and value fields",
      "assertion_pseudocode": "result = run_cli(['spec', 'validate', '--spec', 'bad_schema_spec']); parsed = json.parse(result.stdout); assert parsed['valid'] == false; schema_errs = [e for e in parsed['errors'] if e['category'] == 'schema']; assert len(schema_errs) > 0; err = schema_errs[0]; assert 'artifact' in err; assert 'path' in err; assert 'message' in err; assert 'value' in err"
    },
    {
      "id": "TS-05-12",
      "requirement_id": "05-REQ-3.2",
      "kind": "integration",
      "description": "Verify that spec validate emits a structured error object with category='integrity', check, message, and requirement_id for integrity check failures.",
      "preconditions": [
        "spec CLI is installed",
        "A spec with a known integrity violation exists (e.g., a requirement with no test cases in test_spec)"
      ],
      "input": "Invoke `spec validate` on a spec with an integrity error (missing test case coverage)",
      "expected": "stdout JSON errors array contains at least one object with category='integrity', non-empty check, message, and requirement_id fields",